{
  "address": "0x050D18b23e1b2fCaeA01a73b0eB82906323a30E9",
  "abi": [
    {
      "inputs": [
        {
          "internalType": "uint256",
          "name": "baseRatePerYear",
          "type": "uint256"
        },
        {
          "internalType": "uint256",
          "name": "multiplierPerYear",
          "type": "uint256"
        },
        {
          "internalType": "uint256",
          "name": "jumpMultiplierPerYear",
          "type": "uint256"
        },
        {
          "internalType": "uint256",
          "name": "kink1_",
          "type": "uint256"
        },
        {
          "internalType": "uint256",
          "name": "kink2_",
          "type": "uint256"
        },
        {
          "internalType": "uint256",
          "name": "roof_",
          "type": "uint256"
        }
      ],
      "payable": false,
      "stateMutability": "nonpayable",
      "type": "constructor"
    },
    {
      "anonymous": false,
      "inputs": [
        {
          "indexed": false,
          "internalType": "uint256",
          "name": "baseRatePerBlock",
          "type": "uint256"
        },
        {
          "indexed": false,
          "internalType": "uint256",
          "name": "multiplierPerBlock",
          "type": "uint256"
        },
        {
          "indexed": false,
          "internalType": "uint256",
          "name": "jumpMultiplierPerBlock",
          "type": "uint256"
        },
        {
          "indexed": false,
          "internalType": "uint256",
          "name": "kink1",
          "type": "uint256"
        },
        {
          "indexed": false,
          "internalType": "uint256",
          "name": "kink2",
          "type": "uint256"
        },
        {
          "indexed": false,
          "internalType": "uint256",
          "name": "roof",
          "type": "uint256"
        }
      ],
      "name": "NewInterestParams",
      "type": "event"
    },
    {
      "constant": true,
      "inputs": [],
      "name": "baseRatePerBlock",
      "outputs": [
        {
          "internalType": "uint256",
          "name": "",
          "type": "uint256"
        }
      ],
      "payable": false,
      "stateMutability": "view",
      "type": "function"
    },
    {
      "constant": true,
      "inputs": [],
      "name": "blocksPerYear",
      "outputs": [
        {
          "internalType": "uint256",
          "name": "",
          "type": "uint256"
        }
      ],
      "payable": false,
      "stateMutability": "view",
      "type": "function"
    },
    {
      "constant": true,
      "inputs": [
        {
          "internalType": "uint256",
          "name": "cash",
          "type": "uint256"
        },
        {
          "internalType": "uint256",
          "name": "borrows",
          "type": "uint256"
        },
        {
          "internalType": "uint256",
          "name": "reserves",
          "type": "uint256"
        }
      ],
      "name": "getBorrowRate",
      "outputs": [
        {
          "internalType": "uint256",
          "name": "",
          "type": "uint256"
        }
      ],
      "payable": false,
      "stateMutability": "view",
      "type": "function"
    },
    {
      "constant": true,
      "inputs": [
        {
          "internalType": "uint256",
          "name": "cash",
          "type": "uint256"
        },
        {
          "internalType": "uint256",
          "name": "borrows",
          "type": "uint256"
        },
        {
          "internalType": "uint256",
          "name": "reserves",
          "type": "uint256"
        },
        {
          "internalType": "uint256",
          "name": "reserveFactorMantissa",
          "type": "uint256"
        }
      ],
      "name": "getSupplyRate",
      "outputs": [
        {
          "internalType": "uint256",
          "name": "",
          "type": "uint256"
        }
      ],
      "payable": false,
      "stateMutability": "view",
      "type": "function"
    },
    {
      "constant": true,
      "inputs": [],
      "name": "isInterestRateModel",
      "outputs": [
        {
          "internalType": "bool",
          "name": "",
          "type": "bool"
        }
      ],
      "payable": false,
      "stateMutability": "view",
      "type": "function"
    },
    {
      "constant": true,
      "inputs": [],
      "name": "jumpMultiplierPerBlock",
      "outputs": [
        {
          "internalType": "uint256",
          "name": "",
          "type": "uint256"
        }
      ],
      "payable": false,
      "stateMutability": "view",
      "type": "function"
    },
    {
      "constant": true,
      "inputs": [],
      "name": "kink1",
      "outputs": [
        {
          "internalType": "uint256",
          "name": "",
          "type": "uint256"
        }
      ],
      "payable": false,
      "stateMutability": "view",
      "type": "function"
    },
    {
      "constant": true,
      "inputs": [],
      "name": "kink2",
      "outputs": [
        {
          "internalType": "uint256",
          "name": "",
          "type": "uint256"
        }
      ],
      "payable": false,
      "stateMutability": "view",
      "type": "function"
    },
    {
      "constant": true,
      "inputs": [],
      "name": "multiplierPerBlock",
      "outputs": [
        {
          "internalType": "uint256",
          "name": "",
          "type": "uint256"
        }
      ],
      "payable": false,
      "stateMutability": "view",
      "type": "function"
    },
    {
      "constant": true,
      "inputs": [],
      "name": "roof",
      "outputs": [
        {
          "internalType": "uint256",
          "name": "",
          "type": "uint256"
        }
      ],
      "payable": false,
      "stateMutability": "view",
      "type": "function"
    },
    {
      "constant": true,
      "inputs": [
        {
          "internalType": "uint256",
          "name": "cash",
          "type": "uint256"
        },
        {
          "internalType": "uint256",
          "name": "borrows",
          "type": "uint256"
        },
        {
          "internalType": "uint256",
          "name": "reserves",
          "type": "uint256"
        }
      ],
      "name": "utilizationRate",
      "outputs": [
        {
          "internalType": "uint256",
          "name": "",
          "type": "uint256"
        }
      ],
      "payable": false,
      "stateMutability": "view",
      "type": "function"
    }
  ],
  "transactionHash": "0x68718dac2e3e1a34cf4e13e5e4b8f63e3b65f4d3a955855ffc2a54fe01ac6854",
  "receipt": {
    "to": null,
    "from": "0x1BA608D6a354fbEb41FD7cC799e7f09b2612AB26",
    "contractAddress": "0x050D18b23e1b2fCaeA01a73b0eB82906323a30E9",
    "transactionIndex": 0,
    "gasUsed": "531888",
    "logsBloom": "0x00000000000000000000000000000000000000000000000000000000000000000800000000000000000000000000000000000000000000000000000000000000000000000000000000000000000000000000000000000000000000000000000000000000000000000000000000000000000000000004000000000000000000000000000000000000000000000000000000000000000008000000000001010000000000000000000000000000000000000000000000000000000000000000000000000000000000000000000000000000000000002000000000000000000000000000000000000000000000000000000000000000000000000000000000000000",
    "blockHash": "0x380cddc0455f610a3b3cdbcdb53f4338356aac5e86c4f1e7c1724a6b3f5b567d",
    "transactionHash": "0x68718dac2e3e1a34cf4e13e5e4b8f63e3b65f4d3a955855ffc2a54fe01ac6854",
    "logs": [
      {
        "transactionIndex": 0,
        "blockNumber": 21927005,
        "transactionHash": "0x68718dac2e3e1a34cf4e13e5e4b8f63e3b65f4d3a955855ffc2a54fe01ac6854",
        "address": "0x050D18b23e1b2fCaeA01a73b0eB82906323a30E9",
        "topics": [
          "0x4b73aac5f6a6d7f85af810fb244e35fa994ef635f5806dadef27143533fb6436"
        ],
        "data": "0x00000000000000000000000000000000000000000000000000000000000000000000000000000000000000000000000000000000000000000000000133221ded0000000000000000000000000000000000000000000000000000003b1068377e0000000000000000000000000000000000000000000000000b1a2bc2ec5000000000000000000000000000000000000000000000000000000c7d713b49da000000000000000000000000000000000000000000000000000014d1120d7b160000",
        "logIndex": 0,
        "blockHash": "0x380cddc0455f610a3b3cdbcdb53f4338356aac5e86c4f1e7c1724a6b3f5b567d"
      }
    ],
    "blockNumber": 21927005,
    "cumulativeGasUsed": "531888",
    "status": 1,
    "byzantium": true
  },
  "args": [
    0,
    "130000000000000000",
    "8000000000000000000",
    "800000000000000000",
    "900000000000000000",
    "1500000000000000000"
  ],
  "numDeployments": 1,
  "solcInputHash": "bce33cc31deedfc1f421148f109f44c7",
  "metadata": "{\"compiler\":{\"version\":\"0.5.17+commit.d19bba13\"},\"language\":\"Solidity\",\"output\":{\"abi\":[{\"inputs\":[{\"internalType\":\"uint256\",\"name\":\"baseRatePerYear\",\"type\":\"uint256\"},{\"internalType\":\"uint256\",\"name\":\"multiplierPerYear\",\"type\":\"uint256\"},{\"internalType\":\"uint256\",\"name\":\"jumpMultiplierPerYear\",\"type\":\"uint256\"},{\"internalType\":\"uint256\",\"name\":\"kink1_\",\"type\":\"uint256\"},{\"internalType\":\"uint256\",\"name\":\"kink2_\",\"type\":\"uint256\"},{\"internalType\":\"uint256\",\"name\":\"roof_\",\"type\":\"uint256\"}],\"payable\":false,\"stateMutability\":\"nonpayable\",\"type\":\"constructor\"},{\"anonymous\":false,\"inputs\":[{\"indexed\":false,\"internalType\":\"uint256\",\"name\":\"baseRatePerBlock\",\"type\":\"uint256\"},{\"indexed\":false,\"internalType\":\"uint256\",\"name\":\"multiplierPerBlock\",\"type\":\"uint256\"},{\"indexed\":false,\"internalType\":\"uint256\",\"name\":\"jumpMultiplierPerBlock\",\"type\":\"uint256\"},{\"indexed\":false,\"internalType\":\"uint256\",\"name\":\"kink1\",\"type\":\"uint256\"},{\"indexed\":false,\"internalType\":\"uint256\",\"name\":\"kink2\",\"type\":\"uint256\"},{\"indexed\":false,\"internalType\":\"uint256\",\"name\":\"roof\",\"type\":\"uint256\"}],\"name\":\"NewInterestParams\",\"type\":\"event\"},{\"constant\":true,\"inputs\":[],\"name\":\"baseRatePerBlock\",\"outputs\":[{\"internalType\":\"uint256\",\"name\":\"\",\"type\":\"uint256\"}],\"payable\":false,\"stateMutability\":\"view\",\"type\":\"function\"},{\"constant\":true,\"inputs\":[],\"name\":\"blocksPerYear\",\"outputs\":[{\"internalType\":\"uint256\",\"name\":\"\",\"type\":\"uint256\"}],\"payable\":false,\"stateMutability\":\"view\",\"type\":\"function\"},{\"constant\":true,\"inputs\":[{\"internalType\":\"uint256\",\"name\":\"cash\",\"type\":\"uint256\"},{\"internalType\":\"uint256\",\"name\":\"borrows\",\"type\":\"uint256\"},{\"internalType\":\"uint256\",\"name\":\"reserves\",\"type\":\"uint256\"}],\"name\":\"getBorrowRate\",\"outputs\":[{\"internalType\":\"uint256\",\"name\":\"\",\"type\":\"uint256\"}],\"payable\":false,\"stateMutability\":\"view\",\"type\":\"function\"},{\"constant\":true,\"inputs\":[{\"internalType\":\"uint256\",\"name\":\"cash\",\"type\":\"uint256\"},{\"internalType\":\"uint256\",\"name\":\"borrows\",\"type\":\"uint256\"},{\"internalType\":\"uint256\",\"name\":\"reserves\",\"type\":\"uint256\"},{\"internalType\":\"uint256\",\"name\":\"reserveFactorMantissa\",\"type\":\"uint256\"}],\"name\":\"getSupplyRate\",\"outputs\":[{\"internalType\":\"uint256\",\"name\":\"\",\"type\":\"uint256\"}],\"payable\":false,\"stateMutability\":\"view\",\"type\":\"function\"},{\"constant\":true,\"inputs\":[],\"name\":\"isInterestRateModel\",\"outputs\":[{\"internalType\":\"bool\",\"name\":\"\",\"type\":\"bool\"}],\"payable\":false,\"stateMutability\":\"view\",\"type\":\"function\"},{\"constant\":true,\"inputs\":[],\"name\":\"jumpMultiplierPerBlock\",\"outputs\":[{\"internalType\":\"uint256\",\"name\":\"\",\"type\":\"uint256\"}],\"payable\":false,\"stateMutability\":\"view\",\"type\":\"function\"},{\"constant\":true,\"inputs\":[],\"name\":\"kink1\",\"outputs\":[{\"internalType\":\"uint256\",\"name\":\"\",\"type\":\"uint256\"}],\"payable\":false,\"stateMutability\":\"view\",\"type\":\"function\"},{\"constant\":true,\"inputs\":[],\"name\":\"kink2\",\"outputs\":[{\"internalType\":\"uint256\",\"name\":\"\",\"type\":\"uint256\"}],\"payable\":false,\"stateMutability\":\"view\",\"type\":\"function\"},{\"constant\":true,\"inputs\":[],\"name\":\"multiplierPerBlock\",\"outputs\":[{\"internalType\":\"uint256\",\"name\":\"\",\"type\":\"uint256\"}],\"payable\":false,\"stateMutability\":\"view\",\"type\":\"function\"},{\"constant\":true,\"inputs\":[],\"name\":\"roof\",\"outputs\":[{\"internalType\":\"uint256\",\"name\":\"\",\"type\":\"uint256\"}],\"payable\":false,\"stateMutability\":\"view\",\"type\":\"function\"},{\"constant\":true,\"inputs\":[{\"internalType\":\"uint256\",\"name\":\"cash\",\"type\":\"uint256\"},{\"internalType\":\"uint256\",\"name\":\"borrows\",\"type\":\"uint256\"},{\"internalType\":\"uint256\",\"name\":\"reserves\",\"type\":\"uint256\"}],\"name\":\"utilizationRate\",\"outputs\":[{\"internalType\":\"uint256\",\"name\":\"\",\"type\":\"uint256\"}],\"payable\":false,\"stateMutability\":\"view\",\"type\":\"function\"}],\"devdoc\":{\"author\":\"Iron Bank\",\"methods\":{\"constructor\":{\"params\":{\"baseRatePerYear\":\"The approximate target base APR, as a mantissa (scaled by 1e18)\",\"jumpMultiplierPerYear\":\"The multiplierPerBlock after hitting a specified utilization point\",\"kink1_\":\"The utilization point at which the interest rate is fixed\",\"kink2_\":\"The utilization point at which the jump multiplier is applied\",\"multiplierPerYear\":\"The rate of increase in interest rate wrt utilization (scaled by 1e18)\",\"roof_\":\"The utilization point at which the borrow rate is fixed\"}},\"getBorrowRate(uint256,uint256,uint256)\":{\"params\":{\"borrows\":\"The amount of borrows in the market\",\"cash\":\"The amount of cash in the market\",\"reserves\":\"The amount of reserves in the market\"},\"return\":\"The borrow rate percentage per block as a mantissa (scaled by 1e18)\"},\"getSupplyRate(uint256,uint256,uint256,uint256)\":{\"params\":{\"borrows\":\"The amount of borrows in the market\",\"cash\":\"The amount of cash in the market\",\"reserveFactorMantissa\":\"The current reserve factor for the market\",\"reserves\":\"The amount of reserves in the market\"},\"return\":\"The supply rate percentage per block as a mantissa (scaled by 1e18)\"},\"utilizationRate(uint256,uint256,uint256)\":{\"params\":{\"borrows\":\"The amount of borrows in the market\",\"cash\":\"The amount of cash in the market\",\"reserves\":\"The amount of reserves in the market (currently unused)\"},\"return\":\"The utilization rate as a mantissa between [0, 1e18]\"}},\"title\":\"Iron Bank's TripleSlopeRateModel Contract\"},\"userdoc\":{\"methods\":{\"constructor\":\"Construct an interest rate model\",\"getBorrowRate(uint256,uint256,uint256)\":{\"notice\":\"Calculates the current borrow rate per block, with the error code expected by the market\"},\"getSupplyRate(uint256,uint256,uint256,uint256)\":{\"notice\":\"Calculates the current supply rate per block\"},\"utilizationRate(uint256,uint256,uint256)\":{\"notice\":\"Calculates the utilization rate of the market: `borrows / (cash + borrows - reserves)`\"}}}},\"settings\":{\"compilationTarget\":{\"contracts/TripleSlopeRateModel.sol\":\"TripleSlopeRateModel\"},\"evmVersion\":\"istanbul\",\"libraries\":{},\"metadata\":{\"useLiteralContent\":true},\"optimizer\":{\"enabled\":true,\"runs\":200},\"remappings\":[]},\"sources\":{\"contracts/InterestRateModel.sol\":{\"content\":\"pragma solidity ^0.5.16;\\n\\n/**\\n * @title Compound's InterestRateModel Interface\\n * @author Compound\\n */\\ncontract InterestRateModel {\\n    /// @notice Indicator that this is an InterestRateModel contract (for inspection)\\n    bool public constant isInterestRateModel = true;\\n\\n    /**\\n     * @notice Calculates the current borrow interest rate per block\\n     * @param cash The total amount of cash the market has\\n     * @param borrows The total amount of borrows the market has outstanding\\n     * @param reserves The total amount of reserves the market has\\n     * @return The borrow rate per block (as a percentage, and scaled by 1e18)\\n     */\\n    function getBorrowRate(\\n        uint256 cash,\\n        uint256 borrows,\\n        uint256 reserves\\n    ) external view returns (uint256);\\n\\n    /**\\n     * @notice Calculates the current supply interest rate per block\\n     * @param cash The total amount of cash the market has\\n     * @param borrows The total amount of borrows the market has outstanding\\n     * @param reserves The total amount of reserves the market has\\n     * @param reserveFactorMantissa The current reserve factor the market has\\n     * @return The supply rate per block (as a percentage, and scaled by 1e18)\\n     */\\n    function getSupplyRate(\\n        uint256 cash,\\n        uint256 borrows,\\n        uint256 reserves,\\n        uint256 reserveFactorMantissa\\n    ) external view returns (uint256);\\n}\\n\",\"keccak256\":\"0x56a8020bb8a9545006984eb08257e577b18612b3f4f533dfb6859ae369ba6544\"},\"contracts/SafeMath.sol\":{\"content\":\"pragma solidity ^0.5.16;\\n\\n// From https://github.com/OpenZeppelin/openzeppelin-contracts/blob/master/contracts/math/Math.sol\\n// Subject to the MIT license.\\n\\n/**\\n * @dev Wrappers over Solidity's arithmetic operations with added overflow\\n * checks.\\n *\\n * Arithmetic operations in Solidity wrap on overflow. This can easily result\\n * in bugs, because programmers usually assume that an overflow raises an\\n * error, which is the standard behavior in high level programming languages.\\n * `SafeMath` restores this intuition by reverting the transaction when an\\n * operation overflows.\\n *\\n * Using this library instead of the unchecked operations eliminates an entire\\n * class of bugs, so it's recommended to use it always.\\n */\\nlibrary SafeMath {\\n    /**\\n     * @dev Returns the addition of two unsigned integers, reverting on overflow.\\n     *\\n     * Counterpart to Solidity's `+` operator.\\n     *\\n     * Requirements:\\n     * - Addition cannot overflow.\\n     */\\n    function add(uint256 a, uint256 b) internal pure returns (uint256) {\\n        uint256 c = a + b;\\n        require(c >= a, \\\"SafeMath: addition overflow\\\");\\n\\n        return c;\\n    }\\n\\n    /**\\n     * @dev Returns the addition of two unsigned integers, reverting with custom message on overflow.\\n     *\\n     * Counterpart to Solidity's `+` operator.\\n     *\\n     * Requirements:\\n     * - Addition cannot overflow.\\n     */\\n    function add(\\n        uint256 a,\\n        uint256 b,\\n        string memory errorMessage\\n    ) internal pure returns (uint256) {\\n        uint256 c = a + b;\\n        require(c >= a, errorMessage);\\n\\n        return c;\\n    }\\n\\n    /**\\n     * @dev Returns the subtraction of two unsigned integers, reverting on underflow (when the result is negative).\\n     *\\n     * Counterpart to Solidity's `-` operator.\\n     *\\n     * Requirements:\\n     * - Subtraction cannot underflow.\\n     */\\n    function sub(uint256 a, uint256 b) internal pure returns (uint256) {\\n        return sub(a, b, \\\"SafeMath: subtraction underflow\\\");\\n    }\\n\\n    /**\\n     * @dev Returns the subtraction of two unsigned integers, reverting with custom message on underflow (when the result is negative).\\n     *\\n     * Counterpart to Solidity's `-` operator.\\n     *\\n     * Requirements:\\n     * - Subtraction cannot underflow.\\n     */\\n    function sub(\\n        uint256 a,\\n        uint256 b,\\n        string memory errorMessage\\n    ) internal pure returns (uint256) {\\n        require(b <= a, errorMessage);\\n        uint256 c = a - b;\\n\\n        return c;\\n    }\\n\\n    /**\\n     * @dev Returns the multiplication of two unsigned integers, reverting on overflow.\\n     *\\n     * Counterpart to Solidity's `*` operator.\\n     *\\n     * Requirements:\\n     * - Multiplication cannot overflow.\\n     */\\n    function mul(uint256 a, uint256 b) internal pure returns (uint256) {\\n        // Gas optimization: this is cheaper than requiring 'a' not being zero, but the\\n        // benefit is lost if 'b' is also tested.\\n        // See: https://github.com/OpenZeppelin/openzeppelin-contracts/pull/522\\n        if (a == 0) {\\n            return 0;\\n        }\\n\\n        uint256 c = a * b;\\n        require(c / a == b, \\\"SafeMath: multiplication overflow\\\");\\n\\n        return c;\\n    }\\n\\n    /**\\n     * @dev Returns the multiplication of two unsigned integers, reverting on overflow.\\n     *\\n     * Counterpart to Solidity's `*` operator.\\n     *\\n     * Requirements:\\n     * - Multiplication cannot overflow.\\n     */\\n    function mul(\\n        uint256 a,\\n        uint256 b,\\n        string memory errorMessage\\n    ) internal pure returns (uint256) {\\n        // Gas optimization: this is cheaper than requiring 'a' not being zero, but the\\n        // benefit is lost if 'b' is also tested.\\n        // See: https://github.com/OpenZeppelin/openzeppelin-contracts/pull/522\\n        if (a == 0) {\\n            return 0;\\n        }\\n\\n        uint256 c = a * b;\\n        require(c / a == b, errorMessage);\\n\\n        return c;\\n    }\\n\\n    /**\\n     * @dev Returns the integer division of two unsigned integers.\\n     * Reverts on division by zero. The result is rounded towards zero.\\n     *\\n     * Counterpart to Solidity's `/` operator. Note: this function uses a\\n     * `revert` opcode (which leaves remaining gas untouched) while Solidity\\n     * uses an invalid opcode to revert (consuming all remaining gas).\\n     *\\n     * Requirements:\\n     * - The divisor cannot be zero.\\n     */\\n    function div(uint256 a, uint256 b) internal pure returns (uint256) {\\n        return div(a, b, \\\"SafeMath: division by zero\\\");\\n    }\\n\\n    /**\\n     * @dev Returns the integer division of two unsigned integers.\\n     * Reverts with custom message on division by zero. The result is rounded towards zero.\\n     *\\n     * Counterpart to Solidity's `/` operator. Note: this function uses a\\n     * `revert` opcode (which leaves remaining gas untouched) while Solidity\\n     * uses an invalid opcode to revert (consuming all remaining gas).\\n     *\\n     * Requirements:\\n     * - The divisor cannot be zero.\\n     */\\n    function div(\\n        uint256 a,\\n        uint256 b,\\n        string memory errorMessage\\n    ) internal pure returns (uint256) {\\n        // Solidity only automatically asserts when dividing by 0\\n        require(b > 0, errorMessage);\\n        uint256 c = a / b;\\n        // assert(a == b * c + a % b); // There is no case in which this doesn't hold\\n\\n        return c;\\n    }\\n\\n    /**\\n     * @dev Returns the remainder of dividing two unsigned integers. (unsigned integer modulo),\\n     * Reverts when dividing by zero.\\n     *\\n     * Counterpart to Solidity's `%` operator. This function uses a `revert`\\n     * opcode (which leaves remaining gas untouched) while Solidity uses an\\n     * invalid opcode to revert (consuming all remaining gas).\\n     *\\n     * Requirements:\\n     * - The divisor cannot be zero.\\n     */\\n    function mod(uint256 a, uint256 b) internal pure returns (uint256) {\\n        return mod(a, b, \\\"SafeMath: modulo by zero\\\");\\n    }\\n\\n    /**\\n     * @dev Returns the remainder of dividing two unsigned integers. (unsigned integer modulo),\\n     * Reverts with custom message when dividing by zero.\\n     *\\n     * Counterpart to Solidity's `%` operator. This function uses a `revert`\\n     * opcode (which leaves remaining gas untouched) while Solidity uses an\\n     * invalid opcode to revert (consuming all remaining gas).\\n     *\\n     * Requirements:\\n     * - The divisor cannot be zero.\\n     */\\n    function mod(\\n        uint256 a,\\n        uint256 b,\\n        string memory errorMessage\\n    ) internal pure returns (uint256) {\\n        require(b != 0, errorMessage);\\n        return a % b;\\n    }\\n}\\n\",\"keccak256\":\"0x2c550d835fddaa7147ed5a8fb5f213d57879435221810b6ea542c2671d50ed02\"},\"contracts/TripleSlopeRateModel.sol\":{\"content\":\"pragma solidity ^0.5.16;\\n\\nimport \\\"./InterestRateModel.sol\\\";\\nimport \\\"./SafeMath.sol\\\";\\n\\n/**\\n * @title Iron Bank's TripleSlopeRateModel Contract\\n * @author Iron Bank\\n */\\ncontract TripleSlopeRateModel is InterestRateModel {\\n    using SafeMath for uint256;\\n\\n    event NewInterestParams(\\n        uint256 baseRatePerBlock,\\n        uint256 multiplierPerBlock,\\n        uint256 jumpMultiplierPerBlock,\\n        uint256 kink1,\\n        uint256 kink2,\\n        uint256 roof\\n    );\\n\\n    /**\\n     * @notice The approximate number of blocks per year that is assumed by the interest rate model\\n     */\\n    uint256 public constant blocksPerYear = 31536000;\\n\\n    /**\\n     * @notice The minimum roof value used for calculating borrow rate.\\n     */\\n    uint256 internal constant minRoofValue = 1e18;\\n\\n    /**\\n     * @notice The multiplier of utilization rate that gives the slope of the interest rate\\n     */\\n    uint256 public multiplierPerBlock;\\n\\n    /**\\n     * @notice The base interest rate which is the y-intercept when utilization rate is 0\\n     */\\n    uint256 public baseRatePerBlock;\\n\\n    /**\\n     * @notice The multiplierPerBlock after hitting a specified utilization point\\n     */\\n    uint256 public jumpMultiplierPerBlock;\\n\\n    /**\\n     * @notice The utilization point at which the interest rate is fixed\\n     */\\n    uint256 public kink1;\\n\\n    /**\\n     * @notice The utilization point at which the jump multiplier is applied\\n     */\\n    uint256 public kink2;\\n\\n    /**\\n     * @notice The utilization point at which the rate is fixed\\n     */\\n    uint256 public roof;\\n\\n    /**\\n     * @notice Construct an interest rate model\\n     * @param baseRatePerYear The approximate target base APR, as a mantissa (scaled by 1e18)\\n     * @param multiplierPerYear The rate of increase in interest rate wrt utilization (scaled by 1e18)\\n     * @param jumpMultiplierPerYear The multiplierPerBlock after hitting a specified utilization point\\n     * @param kink1_ The utilization point at which the interest rate is fixed\\n     * @param kink2_ The utilization point at which the jump multiplier is applied\\n     * @param roof_ The utilization point at which the borrow rate is fixed\\n     */\\n    constructor(\\n        uint256 baseRatePerYear,\\n        uint256 multiplierPerYear,\\n        uint256 jumpMultiplierPerYear,\\n        uint256 kink1_,\\n        uint256 kink2_,\\n        uint256 roof_\\n    ) public {\\n        updateTripleRateModelInternal(baseRatePerYear, multiplierPerYear, jumpMultiplierPerYear, kink1_, kink2_, roof_);\\n    }\\n\\n    /**\\n     * @notice Calculates the utilization rate of the market: `borrows / (cash + borrows - reserves)`\\n     * @param cash The amount of cash in the market\\n     * @param borrows The amount of borrows in the market\\n     * @param reserves The amount of reserves in the market (currently unused)\\n     * @return The utilization rate as a mantissa between [0, 1e18]\\n     */\\n    function utilizationRate(\\n        uint256 cash,\\n        uint256 borrows,\\n        uint256 reserves\\n    ) public view returns (uint256) {\\n        // Utilization rate is 0 when there are no borrows\\n        if (borrows == 0) {\\n            return 0;\\n        }\\n\\n        uint256 util = borrows.mul(1e18).div(cash.add(borrows).sub(reserves));\\n        // If the utilization is above the roof, cap it.\\n        if (util > roof) {\\n            util = roof;\\n        }\\n        return util;\\n    }\\n\\n    /**\\n     * @notice Calculates the current borrow rate per block, with the error code expected by the market\\n     * @param cash The amount of cash in the market\\n     * @param borrows The amount of borrows in the market\\n     * @param reserves The amount of reserves in the market\\n     * @return The borrow rate percentage per block as a mantissa (scaled by 1e18)\\n     */\\n    function getBorrowRate(\\n        uint256 cash,\\n        uint256 borrows,\\n        uint256 reserves\\n    ) public view returns (uint256) {\\n        uint256 util = utilizationRate(cash, borrows, reserves);\\n\\n        if (util <= kink1) {\\n            return util.mul(multiplierPerBlock).div(1e18).add(baseRatePerBlock);\\n        } else if (util <= kink2) {\\n            return kink1.mul(multiplierPerBlock).div(1e18).add(baseRatePerBlock);\\n        } else {\\n            uint256 normalRate = kink1.mul(multiplierPerBlock).div(1e18).add(baseRatePerBlock);\\n            uint256 excessUtil = util.sub(kink2);\\n            return excessUtil.mul(jumpMultiplierPerBlock).div(1e18).add(normalRate);\\n        }\\n    }\\n\\n    /**\\n     * @notice Calculates the current supply rate per block\\n     * @param cash The amount of cash in the market\\n     * @param borrows The amount of borrows in the market\\n     * @param reserves The amount of reserves in the market\\n     * @param reserveFactorMantissa The current reserve factor for the market\\n     * @return The supply rate percentage per block as a mantissa (scaled by 1e18)\\n     */\\n    function getSupplyRate(\\n        uint256 cash,\\n        uint256 borrows,\\n        uint256 reserves,\\n        uint256 reserveFactorMantissa\\n    ) public view returns (uint256) {\\n        uint256 oneMinusReserveFactor = uint256(1e18).sub(reserveFactorMantissa);\\n        uint256 borrowRate = getBorrowRate(cash, borrows, reserves);\\n        uint256 rateToPool = borrowRate.mul(oneMinusReserveFactor).div(1e18);\\n        return utilizationRate(cash, borrows, reserves).mul(rateToPool).div(1e18);\\n    }\\n\\n    /**\\n     * @notice Internal function to update the parameters of the interest rate model\\n     * @param baseRatePerYear The approximate target base APR, as a mantissa (scaled by 1e18)\\n     * @param multiplierPerYear The rate of increase in interest rate wrt utilization (scaled by 1e18)\\n     * @param jumpMultiplierPerYear The multiplierPerBlock after hitting a specified utilization point\\n     * @param kink1_ The utilization point at which the interest rate is fixed\\n     * @param kink2_ The utilization point at which the jump multiplier is applied\\n     * @param roof_ The utilization point at which the borrow rate is fixed\\n     */\\n    function updateTripleRateModelInternal(\\n        uint256 baseRatePerYear,\\n        uint256 multiplierPerYear,\\n        uint256 jumpMultiplierPerYear,\\n        uint256 kink1_,\\n        uint256 kink2_,\\n        uint256 roof_\\n    ) internal {\\n        require(kink1_ <= kink2_, \\\"kink1 must less than or equal to kink2\\\");\\n        require(roof_ >= minRoofValue, \\\"invalid roof value\\\");\\n\\n        baseRatePerBlock = baseRatePerYear.div(blocksPerYear);\\n        multiplierPerBlock = (multiplierPerYear.mul(1e18)).div(blocksPerYear.mul(kink1_));\\n        jumpMultiplierPerBlock = jumpMultiplierPerYear.div(blocksPerYear);\\n        kink1 = kink1_;\\n        kink2 = kink2_;\\n        roof = roof_;\\n\\n        emit NewInterestParams(baseRatePerBlock, multiplierPerBlock, jumpMultiplierPerBlock, kink1, kink2, roof);\\n    }\\n}\\n\",\"keccak256\":\"0x290e84ccd3f82f88a80720f11b86d6102d73f560c587edd89762f21275f61cc3\"}},\"version\":1}",
  "bytecode": "0x608060405234801561001057600080fd5b506040516109f33803806109f3833981810160405260c081101561003357600080fd5b508051602082015160408301516060840151608085015160a090950151939492939192909161006f8686868686866001600160e01b0361007a16565b505050505050610357565b818311156100b95760405162461bcd60e51b81526004018080602001828103825260268152602001806109cd6026913960400191505060405180910390fd5b670de0b6b3a764000081101561010b576040805162461bcd60e51b8152602060048201526012602482015271696e76616c696420726f6f662076616c756560701b604482015290519081900360640190fd5b6101266301e133808761020b60201b6104161790919060201c565b6001556101766101456301e133808561025c602090811b6103b417901c565b610164670de0b6b3a76400008861025c60201b6103b41790919060201c565b61020b60201b6104161790919060201c565b600055610192846301e1338061020b602090811b61041617901c565b600281905560038490556004839055600582905560015460005460408051928352602083019190915281810192909252606081018590526080810184905260a0810183905290517f4b73aac5f6a6d7f85af810fb244e35fa994ef635f5806dadef27143533fb64369181900360c00190a1505050505050565b600061025383836040518060400160405280601a81526020017f536166654d6174683a206469766973696f6e206279207a65726f0000000000008152506102b560201b60201c565b90505b92915050565b60008261026b57506000610256565b8282028284828161027857fe5b04146102535760405162461bcd60e51b81526004018080602001828103825260218152602001806109ac6021913960400191505060405180910390fd5b600081836103415760405162461bcd60e51b81526004018080602001828103825283818151815260200191508051906020019080838360005b838110156103065781810151838201526020016102ee565b50505050905090810190601f1680156103335780820380516001836020036101000a031916815260200191505b509250505060405180910390fd5b50600083858161034d57fe5b0495945050505050565b610646806103666000396000f3fe608060405234801561001057600080fd5b50600436106100a95760003560e01c80638726bb89116100715780638726bb891461013e578063a385fb9614610146578063b81688161461014e578063b9f9850a1461017d578063d34f611414610185578063f14039de1461018d576100a9565b806315f24053146100ae5780632191f92a146100e957806350af8cd614610105578063573be0fb1461010d5780636e71e2d814610115575b600080fd5b6100d7600480360360608110156100c457600080fd5b5080359060208101359060400135610195565b60408051918252519081900360200190f35b6100f161029f565b604080519115158252519081900360200190f35b6100d76102a4565b6100d76102aa565b6100d76004803603606081101561012b57600080fd5b50803590602081013590604001356102b0565b6100d7610315565b6100d761031b565b6100d76004803603608081101561016457600080fd5b5080359060208101359060408101359060600135610323565b6100d76103a2565b6100d76103a8565b6100d76103ae565b6000806101a38585856102b0565b905060035481116101f5576101ed6001546101e1670de0b6b3a76400006101d5600054866103b490919063ffffffff16565b9063ffffffff61041616565b9063ffffffff61045816565b915050610298565b6004548111610227576101ed6001546101e1670de0b6b3a76400006101d56000546003546103b490919063ffffffff16565b60006102526001546101e1670de0b6b3a76400006101d56000546003546103b490919063ffffffff16565b9050600061026b600454846104b290919063ffffffff16565b9050610292826101e1670de0b6b3a76400006101d5600254866103b490919063ffffffff16565b93505050505b9392505050565b600181565b60045481565b60055481565b6000826102bf57506000610298565b60006102fc6102e4846102d8888863ffffffff61045816565b9063ffffffff6104b216565b6101d586670de0b6b3a764000063ffffffff6103b416565b905060055481111561030d57506005545b949350505050565b60005481565b6301e1338081565b60008061033e670de0b6b3a76400008463ffffffff6104b216565b9050600061034d878787610195565b9050600061036d670de0b6b3a76400006101d5848663ffffffff6103b416565b9050610396670de0b6b3a76400006101d58361038a8c8c8c6102b0565b9063ffffffff6103b416565b98975050505050505050565b60025481565b60035481565b60015481565b6000826103c357506000610410565b828202828482816103d057fe5b041461040d5760405162461bcd60e51b81526004018080602001828103825260218152602001806105f16021913960400191505060405180910390fd5b90505b92915050565b600061040d83836040518060400160405280601a81526020017f536166654d6174683a206469766973696f6e206279207a65726f0000000000008152506104f4565b60008282018381101561040d576040805162461bcd60e51b815260206004820152601b60248201527f536166654d6174683a206164646974696f6e206f766572666c6f770000000000604482015290519081900360640190fd5b600061040d83836040518060400160405280601f81526020017f536166654d6174683a207375627472616374696f6e20756e646572666c6f7700815250610596565b600081836105805760405162461bcd60e51b81526004018080602001828103825283818151815260200191508051906020019080838360005b8381101561054557818101518382015260200161052d565b50505050905090810190601f1680156105725780820380516001836020036101000a031916815260200191505b509250505060405180910390fd5b50600083858161058c57fe5b0495945050505050565b600081848411156105e85760405162461bcd60e51b815260206004820181815283516024840152835190928392604490910191908501908083836000831561054557818101518382015260200161052d565b50505090039056fe536166654d6174683a206d756c7469706c69636174696f6e206f766572666c6f77a265627a7a72315820c2d58b3f1e4c75cb424c659a4f3592019987545975c74b9825be12af7534268c64736f6c63430005110032536166654d6174683a206d756c7469706c69636174696f6e206f766572666c6f776b696e6b31206d757374206c657373207468616e206f7220657175616c20746f206b696e6b32",
  "deployedBytecode": "0x608060405234801561001057600080fd5b50600436106100a95760003560e01c80638726bb89116100715780638726bb891461013e578063a385fb9614610146578063b81688161461014e578063b9f9850a1461017d578063d34f611414610185578063f14039de1461018d576100a9565b806315f24053146100ae5780632191f92a146100e957806350af8cd614610105578063573be0fb1461010d5780636e71e2d814610115575b600080fd5b6100d7600480360360608110156100c457600080fd5b5080359060208101359060400135610195565b60408051918252519081900360200190f35b6100f161029f565b604080519115158252519081900360200190f35b6100d76102a4565b6100d76102aa565b6100d76004803603606081101561012b57600080fd5b50803590602081013590604001356102b0565b6100d7610315565b6100d761031b565b6100d76004803603608081101561016457600080fd5b5080359060208101359060408101359060600135610323565b6100d76103a2565b6100d76103a8565b6100d76103ae565b6000806101a38585856102b0565b905060035481116101f5576101ed6001546101e1670de0b6b3a76400006101d5600054866103b490919063ffffffff16565b9063ffffffff61041616565b9063ffffffff61045816565b915050610298565b6004548111610227576101ed6001546101e1670de0b6b3a76400006101d56000546003546103b490919063ffffffff16565b60006102526001546101e1670de0b6b3a76400006101d56000546003546103b490919063ffffffff16565b9050600061026b600454846104b290919063ffffffff16565b9050610292826101e1670de0b6b3a76400006101d5600254866103b490919063ffffffff16565b93505050505b9392505050565b600181565b60045481565b60055481565b6000826102bf57506000610298565b60006102fc6102e4846102d8888863ffffffff61045816565b9063ffffffff6104b216565b6101d586670de0b6b3a764000063ffffffff6103b416565b905060055481111561030d57506005545b949350505050565b60005481565b6301e1338081565b60008061033e670de0b6b3a76400008463ffffffff6104b216565b9050600061034d878787610195565b9050600061036d670de0b6b3a76400006101d5848663ffffffff6103b416565b9050610396670de0b6b3a76400006101d58361038a8c8c8c6102b0565b9063ffffffff6103b416565b98975050505050505050565b60025481565b60035481565b60015481565b6000826103c357506000610410565b828202828482816103d057fe5b041461040d5760405162461bcd60e51b81526004018080602001828103825260218152602001806105f16021913960400191505060405180910390fd5b90505b92915050565b600061040d83836040518060400160405280601a81526020017f536166654d6174683a206469766973696f6e206279207a65726f0000000000008152506104f4565b60008282018381101561040d576040805162461bcd60e51b815260206004820152601b60248201527f536166654d6174683a206164646974696f6e206f766572666c6f770000000000604482015290519081900360640190fd5b600061040d83836040518060400160405280601f81526020017f536166654d6174683a207375627472616374696f6e20756e646572666c6f7700815250610596565b600081836105805760405162461bcd60e51b81526004018080602001828103825283818151815260200191508051906020019080838360005b8381101561054557818101518382015260200161052d565b50505050905090810190601f1680156105725780820380516001836020036101000a031916815260200191505b509250505060405180910390fd5b50600083858161058c57fe5b0495945050505050565b600081848411156105e85760405162461bcd60e51b815260206004820181815283516024840152835190928392604490910191908501908083836000831561054557818101518382015260200161052d565b50505090039056fe536166654d6174683a206d756c7469706c69636174696f6e206f766572666c6f77a265627a7a72315820c2d58b3f1e4c75cb424c659a4f3592019987545975c74b9825be12af7534268c64736f6c63430005110032",
  "devdoc": {
    "author": "Iron Bank",
    "methods": {
      "constructor": {
        "params": {
          "baseRatePerYear": "The approximate target base APR, as a mantissa (scaled by 1e18)",
          "jumpMultiplierPerYear": "The multiplierPerBlock after hitting a specified utilization point",
          "kink1_": "The utilization point at which the interest rate is fixed",
          "kink2_": "The utilization point at which the jump multiplier is applied",
          "multiplierPerYear": "The rate of increase in interest rate wrt utilization (scaled by 1e18)",
          "roof_": "The utilization point at which the borrow rate is fixed"
        }
      },
      "getBorrowRate(uint256,uint256,uint256)": {
        "params": {
          "borrows": "The amount of borrows in the market",
          "cash": "The amount of cash in the market",
          "reserves": "The amount of reserves in the market"
        },
        "return": "The borrow rate percentage per block as a mantissa (scaled by 1e18)"
      },
      "getSupplyRate(uint256,uint256,uint256,uint256)": {
        "params": {
          "borrows": "The amount of borrows in the market",
          "cash": "The amount of cash in the market",
          "reserveFactorMantissa": "The current reserve factor for the market",
          "reserves": "The amount of reserves in the market"
        },
        "return": "The supply rate percentage per block as a mantissa (scaled by 1e18)"
      },
      "utilizationRate(uint256,uint256,uint256)": {
        "params": {
          "borrows": "The amount of borrows in the market",
          "cash": "The amount of cash in the market",
          "reserves": "The amount of reserves in the market (currently unused)"
        },
        "return": "The utilization rate as a mantissa between [0, 1e18]"
      }
    },
    "title": "Iron Bank's TripleSlopeRateModel Contract"
  },
  "userdoc": {
    "methods": {
      "constructor": "Construct an interest rate model",
      "getBorrowRate(uint256,uint256,uint256)": {
        "notice": "Calculates the current borrow rate per block, with the error code expected by the market"
      },
      "getSupplyRate(uint256,uint256,uint256,uint256)": {
        "notice": "Calculates the current supply rate per block"
      },
      "utilizationRate(uint256,uint256,uint256)": {
        "notice": "Calculates the utilization rate of the market: `borrows / (cash + borrows - reserves)`"
      }
    }
  },
  "storageLayout": {
    "storage": [
      {
        "astId": 33263,
        "contract": "contracts/TripleSlopeRateModel.sol:TripleSlopeRateModel",
        "label": "multiplierPerBlock",
        "offset": 0,
        "slot": "0",
        "type": "t_uint256"
      },
      {
        "astId": 33265,
        "contract": "contracts/TripleSlopeRateModel.sol:TripleSlopeRateModel",
        "label": "baseRatePerBlock",
        "offset": 0,
        "slot": "1",
        "type": "t_uint256"
      },
      {
        "astId": 33267,
        "contract": "contracts/TripleSlopeRateModel.sol:TripleSlopeRateModel",
        "label": "jumpMultiplierPerBlock",
        "offset": 0,
        "slot": "2",
        "type": "t_uint256"
      },
      {
        "astId": 33269,
        "contract": "contracts/TripleSlopeRateModel.sol:TripleSlopeRateModel",
        "label": "kink1",
        "offset": 0,
        "slot": "3",
        "type": "t_uint256"
      },
      {
        "astId": 33271,
        "contract": "contracts/TripleSlopeRateModel.sol:TripleSlopeRateModel",
        "label": "kink2",
        "offset": 0,
        "slot": "4",
        "type": "t_uint256"
      },
      {
        "astId": 33273,
        "contract": "contracts/TripleSlopeRateModel.sol:TripleSlopeRateModel",
        "label": "roof",
        "offset": 0,
        "slot": "5",
        "type": "t_uint256"
      }
    ],
    "types": {
      "t_uint256": {
        "encoding": "inplace",
        "label": "uint256",
        "numberOfBytes": "32"
      }
    }
  }
}